{
  "$schema": "https://json-schema.org/draft/2020-12/schema",
  "$id": "https://github.com/CheatEngineNet/CheatEngine.SDK/blob/main/docs/qualification/schemas/support-profile.v0.schema.json",
  "title": "Cheat Engine support profiles, v0",
  "description": "The Cheat Engine host profiles a qualification result can name, the Checkpoint A decisions and the unsupported routes. A documentary profile is never qualifiable. Values are measured or declared facts, never Cheat Engine documentation prose. A sha256 that names a committed JSON document is the SHA-256 of its UTF-8 bytes after CRLF is normalized to LF. Validated by tests/CheatEngine.SDK.Repository.Tests/Qualification.",
  "type": "object",
  "additionalProperties": false,
  "required": [
    "schema",
    "profiles",
    "decisions",
    "unsupportedRoutes"
  ],
  "properties": {
    "schema": {
      "const": "cheatengine-support-profile/v0"
    },
    "profiles": {
      "type": "array",
      "minItems": 2,
      "items": {
        "$ref": "#/$defs/profile"
      }
    },
    "decisions": {
      "type": "array",
      "items": {
        "$ref": "#/$defs/decision"
      }
    },
    "unsupportedRoutes": {
      "type": "array",
      "items": {
        "$ref": "#/$defs/unsupportedRoute"
      }
    },
    "measurements": {
      "description": "Dated measurements behind the profile values, kept apart from values that are only declared by a repository file.",
      "type": "array",
      "items": {
        "$ref": "#/$defs/measurement"
      }
    }
  },
  "$defs": {
    "sha256": {
      "type": "string",
      "pattern": "^[0-9a-f]{64}$"
    },
    "gitObjectId": {
      "type": "string",
      "pattern": "^[0-9a-f]{40}$"
    },
    "date": {
      "type": "string",
      "pattern": "^\\d{4}-\\d{2}-\\d{2}$"
    },
    "text": {
      "type": "string",
      "pattern": "\\S"
    },
    "evidenceKind": {
      "enum": [
        "ObservedSource",
        "DeclaredRepo",
        "Deduced",
        "ToQualify",
        "ProposedDecision",
        "ObservedHost",
        "ExactBinary",
        "ExactInstalledFile",
        "PinnedUpstream",
        "ObservedLive",
        "Inferred",
        "Unknown"
      ]
    },
    "profile": {
      "type": "object",
      "additionalProperties": false,
      "required": [
        "id",
        "kind",
        "qualifiable",
        "qualificationStatus",
        "description",
        "celua",
        "evidenceKind"
      ],
      "properties": {
        "id": {
          "type": "string",
          "pattern": "^[a-z0-9][a-z0-9.-]*$"
        },
        "kind": {
          "enum": [
            "Documentary",
            "Qualifiable"
          ]
        },
        "qualifiable": {
          "type": "boolean"
        },
        "qualificationStatus": {
          "enum": [
            "NotExecuted",
            "FixtureQualified",
            "HostQualified"
          ]
        },
        "description": {
          "$ref": "#/$defs/text"
        },
        "source": {
          "$ref": "#/$defs/source"
        },
        "host": {
          "$ref": "#/$defs/host"
        },
        "lua": {
          "$ref": "#/$defs/lua"
        },
        "celua": {
          "$ref": "#/$defs/celua"
        },
        "runtime": {
          "$ref": "#/$defs/runtime"
        },
        "registry": {
          "$ref": "#/$defs/registry"
        },
        "qualifiedBackends": {
          "type": "array",
          "minItems": 1,
          "items": {
            "enum": [
              "LocalProcess",
              "FileAsProcess",
              "CEServer"
            ]
          }
        },
        "authorizedTargets": {
          "type": "array",
          "minItems": 1,
          "items": {
            "$ref": "#/$defs/authorizedTarget"
          }
        },
        "sdkPluginContractVersion": {
          "type": "integer",
          "minimum": 1
        },
        "evidenceKind": {
          "$ref": "#/$defs/evidenceKind"
        }
      },
      "allOf": [
        {
          "if": {
            "required": [
              "kind"
            ],
            "properties": {
              "kind": {
                "const": "Documentary"
              }
            }
          },
          "then": {
            "required": [
              "source"
            ],
            "properties": {
              "qualifiable": {
                "const": false
              },
              "qualificationStatus": {
                "const": "NotExecuted"
              },
              "host": false,
              "lua": false,
              "runtime": false,
              "registry": false,
              "qualifiedBackends": false,
              "authorizedTargets": false,
              "sdkPluginContractVersion": false
            }
          }
        },
        {
          "if": {
            "required": [
              "kind"
            ],
            "properties": {
              "kind": {
                "const": "Qualifiable"
              }
            }
          },
          "then": {
            "required": [
              "host",
              "lua",
              "runtime",
              "registry",
              "qualifiedBackends",
              "authorizedTargets",
              "sdkPluginContractVersion"
            ],
            "properties": {
              "qualifiable": {
                "const": true
              },
              "source": false
            }
          }
        }
      ]
    },
    "source": {
      "type": "object",
      "additionalProperties": false,
      "required": [
        "repository",
        "commit"
      ],
      "properties": {
        "repository": {
          "type": "string",
          "pattern": "^[A-Za-z0-9-]+/[A-Za-z0-9._-]+$"
        },
        "commit": {
          "$ref": "#/$defs/gitObjectId"
        }
      }
    },
    "host": {
      "type": "object",
      "additionalProperties": false,
      "required": [
        "product",
        "version",
        "exeName",
        "exeSha256",
        "machine",
        "excludedVariants"
      ],
      "properties": {
        "product": {
          "$ref": "#/$defs/text"
        },
        "version": {
          "type": "string",
          "pattern": "^\\d+\\.\\d+\\.\\d+\\.\\d+$"
        },
        "exeName": {
          "type": "string",
          "pattern": "^[^\\\\/:]+\\.exe$"
        },
        "exeSha256": {
          "$ref": "#/$defs/sha256"
        },
        "machine": {
          "enum": [
            "AMD64",
            "I386",
            "ARM64"
          ]
        },
        "excludedVariants": {
          "type": "array",
          "items": {
            "$ref": "#/$defs/excludedVariant"
          }
        }
      }
    },
    "excludedVariant": {
      "type": "object",
      "additionalProperties": false,
      "required": [
        "exeName",
        "sha256",
        "reason"
      ],
      "properties": {
        "exeName": {
          "type": "string",
          "pattern": "^[^\\\\/:]+\\.exe$"
        },
        "sha256": {
          "$ref": "#/$defs/sha256"
        },
        "reason": {
          "$ref": "#/$defs/text"
        }
      }
    },
    "lua": {
      "type": "object",
      "additionalProperties": false,
      "required": [
        "module",
        "sha256"
      ],
      "properties": {
        "module": {
          "type": "string",
          "pattern": "^[^\\\\/:]+\\.dll$"
        },
        "sha256": {
          "$ref": "#/$defs/sha256"
        }
      }
    },
    "celua": {
      "type": "object",
      "additionalProperties": false,
      "required": [
        "sha256"
      ],
      "properties": {
        "sha256": {
          "$ref": "#/$defs/sha256"
        }
      }
    },
    "runtime": {
      "type": "object",
      "additionalProperties": false,
      "required": [
        "loadProfile",
        "runtimeconfig",
        "dotnetRuntimesObserved"
      ],
      "properties": {
        "loadProfile": {
          "const": "managed-hostfxr"
        },
        "runtimeconfig": {
          "$ref": "#/$defs/runtimeconfig"
        },
        "dotnetRuntimesObserved": {
          "type": "array",
          "items": {
            "$ref": "#/$defs/dotnetRuntime"
          }
        }
      }
    },
    "runtimeconfig": {
      "type": "object",
      "additionalProperties": false,
      "required": [
        "sha256",
        "classification",
        "observedDate",
        "tfm",
        "frameworks"
      ],
      "properties": {
        "sha256": {
          "$ref": "#/$defs/sha256"
        },
        "classification": {
          "enum": [
            "LocalModified",
            "Installer",
            "Unknown"
          ]
        },
        "observedDate": {
          "$ref": "#/$defs/date"
        },
        "tfm": {
          "type": "string",
          "pattern": "^net\\d+\\.\\d+$"
        },
        "frameworks": {
          "type": "array",
          "minItems": 1,
          "items": {
            "$ref": "#/$defs/framework"
          }
        }
      }
    },
    "framework": {
      "type": "object",
      "additionalProperties": false,
      "required": [
        "name",
        "version",
        "rollForward"
      ],
      "properties": {
        "name": {
          "type": "string",
          "pattern": "^Microsoft\\.[A-Za-z.]+$"
        },
        "version": {
          "type": "string",
          "pattern": "^\\d+\\.\\d+\\.\\d+$"
        },
        "rollForward": {
          "enum": [
            "Disable",
            "LatestPatch",
            "Minor",
            "LatestMinor",
            "Major",
            "LatestMajor"
          ]
        }
      }
    },
    "dotnetRuntime": {
      "type": "object",
      "additionalProperties": false,
      "required": [
        "name",
        "version",
        "architecture"
      ],
      "properties": {
        "name": {
          "type": "string",
          "pattern": "^Microsoft\\.[A-Za-z.]+$"
        },
        "version": {
          "type": "string",
          "pattern": "^\\d+\\.\\d+\\.\\d+$"
        },
        "architecture": {
          "enum": [
            "x64",
            "x86",
            "arm64"
          ]
        }
      }
    },
    "registry": {
      "type": "object",
      "additionalProperties": false,
      "required": [
        "key",
        "sharedAcrossCopies",
        "profileRelevantValues"
      ],
      "properties": {
        "key": {
          "const": "HKCU\\Software\\Cheat Engine"
        },
        "sharedAcrossCopies": {
          "const": true
        },
        "profileRelevantValues": {
          "type": "array",
          "items": {
            "$ref": "#/$defs/registryName"
          }
        }
      }
    },
    "registryName": {
      "description": "A registry subkey or value name only. Registry data is private and never recorded.",
      "type": "object",
      "additionalProperties": false,
      "required": [
        "kind",
        "name",
        "reason"
      ],
      "properties": {
        "kind": {
          "enum": [
            "Subkey",
            "Value"
          ]
        },
        "name": {
          "$ref": "#/$defs/text"
        },
        "reason": {
          "$ref": "#/$defs/text"
        }
      }
    },
    "authorizedTarget": {
      "type": "object",
      "additionalProperties": false,
      "required": [
        "kind",
        "arch",
        "sha256",
        "source"
      ],
      "properties": {
        "kind": {
          "enum": [
            "QualificationTarget",
            "GtutorialI386"
          ]
        },
        "arch": {
          "enum": [
            "x64",
            "x86"
          ]
        },
        "sha256": {
          "anyOf": [
            {
              "$ref": "#/$defs/sha256"
            },
            {
              "type": "null"
            }
          ]
        },
        "source": {
          "$ref": "#/$defs/text"
        }
      }
    },
    "decision": {
      "type": "object",
      "additionalProperties": false,
      "required": [
        "id",
        "date",
        "text",
        "evidenceKind"
      ],
      "properties": {
        "id": {
          "type": "string",
          "pattern": "^CPA-\\d+$"
        },
        "date": {
          "$ref": "#/$defs/date"
        },
        "text": {
          "$ref": "#/$defs/text"
        },
        "evidenceKind": {
          "$ref": "#/$defs/evidenceKind"
        }
      }
    },
    "unsupportedRoute": {
      "type": "object",
      "additionalProperties": false,
      "required": [
        "id",
        "reason"
      ],
      "properties": {
        "id": {
          "type": "string",
          "pattern": "^[a-z0-9][a-z0-9-]*$"
        },
        "reason": {
          "$ref": "#/$defs/text"
        }
      }
    },
    "measurement": {
      "type": "object",
      "additionalProperties": false,
      "required": [
        "subject",
        "sha256",
        "date",
        "method",
        "evidenceKind",
        "declaredIn"
      ],
      "properties": {
        "subject": {
          "$ref": "#/$defs/text"
        },
        "sha256": {
          "$ref": "#/$defs/sha256"
        },
        "date": {
          "$ref": "#/$defs/date"
        },
        "method": {
          "$ref": "#/$defs/text"
        },
        "evidenceKind": {
          "$ref": "#/$defs/evidenceKind"
        },
        "declaredIn": {
          "description": "Repository-relative files that declare the same value before this measurement; empty when nothing declared it.",
          "type": "array",
          "items": {
            "type": "string",
            "pattern": "^[A-Za-z0-9._-]+(/[A-Za-z0-9._-]+)*(:\\d+(-\\d+)?)?$"
          }
        }
      }
    }
  }
}
