{
  "schema": "cheatengine-support-profile/v0",
  "profiles": [
    {
      "id": "ce-public-src-ec45d5f",
      "kind": "Documentary",
      "qualifiable": false,
      "qualificationStatus": "NotExecuted",
      "description": "Comparative source only: the public cheat-engine/cheat-engine tree at ec45d5f declares version 7.5.1 and the historical string/CLR managed bootstrap (audit analyses/01, lines 20-22). It documents behaviour of that source; it is never proof of the CE 7.7.0.10621 binary and can never back a Passed or Failed qualification result.",
      "source": {
        "repository": "cheat-engine/cheat-engine",
        "commit": "ec45d5f47f92a239ba0bf51ec5d04a7509c3fd37"
      },
      "celua": {
        "sha256": "aa1342b4a5d5d5c65b255fb3a8fd7b6bcbbac1cd138961669d9f37f43e0b9c00"
      },
      "evidenceKind": "ObservedSource"
    },
    {
      "id": "ce-7.7.0.10621-x64-managed-hostfxr",
      "kind": "Qualifiable",
      "qualifiable": true,
      "qualificationStatus": "NotExecuted",
      "description": "The only qualifiable profile: the Cheat Engine 7.7.0.10621 x64 executable identified by its SHA-256, loading managed plugins through nethost/hostfxr with the locally modified ce.runtimeconfig.json recorded below. The SDK plugin contract version (GetVersion) is 6, independent of the Cheat Engine product version. No scenario has run on it yet: every C3/C4 cell of the matrix is NotExecuted until a committed receipt says otherwise.",
      "host": {
        "product": "Cheat Engine",
        "version": "7.7.0.10621",
        "exeName": "cheatengine-x86_64.exe",
        "exeSha256": "9727076da50924e4a097b49a02155e4b34759269c3017ff31375364b8826eb4d",
        "machine": "AMD64",
        "excludedVariants": [
          {
            "exeName": "cheatengine-x86_64-SSE4-AVX2.exe",
            "sha256": "9d861d651ab9d1dc3c09ae34c8ed5dee3d1a29b080784c3c48773494c9350230",
            "reason": "Same FileVersion 7.7.0.10621 but a different binary; not profiled, never used by the runner."
          },
          {
            "exeName": "Cheat Engine.exe",
            "sha256": "5313618d93640bb29b66baadf2339de85e593a51715290dadece6d58e039a75e",
            "reason": "Launcher (FileVersion 6.3.0.0) that selects an executable at run time; never used, the runner starts the profiled executable directly."
          },
          {
            "exeName": "cheatengine-i386.exe",
            "sha256": "0a4b63eadbe824bcc5095a97ccdd8c580573ed72361514025abe1bf25f1387c9",
            "reason": "x86 host: unsupported, the SDK and its native bridge are x64-only."
          }
        ]
      },
      "lua": {
        "module": "lua53-64.dll",
        "sha256": "c95dcdfa0f60f97b43d970d77fd1bb907af4de04b500a3c89a99600b20b35bd2"
      },
      "celua": {
        "sha256": "aa1342b4a5d5d5c65b255fb3a8fd7b6bcbbac1cd138961669d9f37f43e0b9c00"
      },
      "runtime": {
        "loadProfile": "managed-hostfxr",
        "runtimeconfig": {
          "sha256": "68f5d81c0a17cc5bdac40bb3d5d88a624f4d31b414f7195ad847d57b0126ac2b",
          "classification": "LocalModified",
          "observedDate": "2026-09-19",
          "tfm": "net10.0",
          "frameworks": [
            {
              "name": "Microsoft.NETCore.App",
              "version": "10.0.0",
              "rollForward": "LatestMinor"
            },
            {
              "name": "Microsoft.WindowsDesktop.App",
              "version": "10.0.0",
              "rollForward": "LatestMinor"
            },
            {
              "name": "Microsoft.AspNetCore.App",
              "version": "10.0.0",
              "rollForward": "LatestMinor"
            }
          ]
        },
        "dotnetRuntimesObserved": [
          {
            "name": "Microsoft.AspNetCore.App",
            "version": "10.0.8",
            "architecture": "x64"
          },
          {
            "name": "Microsoft.AspNetCore.App",
            "version": "10.0.11",
            "architecture": "x64"
          },
          {
            "name": "Microsoft.AspNetCore.App",
            "version": "10.0.12",
            "architecture": "x64"
          },
          {
            "name": "Microsoft.NETCore.App",
            "version": "8.0.31",
            "architecture": "x64"
          },
          {
            "name": "Microsoft.NETCore.App",
            "version": "10.0.8",
            "architecture": "x64"
          },
          {
            "name": "Microsoft.NETCore.App",
            "version": "10.0.11",
            "architecture": "x64"
          },
          {
            "name": "Microsoft.NETCore.App",
            "version": "10.0.12",
            "architecture": "x64"
          },
          {
            "name": "Microsoft.WindowsDesktop.App",
            "version": "8.0.31",
            "architecture": "x64"
          },
          {
            "name": "Microsoft.WindowsDesktop.App",
            "version": "10.0.8",
            "architecture": "x64"
          },
          {
            "name": "Microsoft.WindowsDesktop.App",
            "version": "10.0.11",
            "architecture": "x64"
          },
          {
            "name": "Microsoft.WindowsDesktop.App",
            "version": "10.0.12",
            "architecture": "x64"
          },
          {
            "name": "Microsoft.NETCore.App",
            "version": "6.0.36",
            "architecture": "x86"
          },
          {
            "name": "Microsoft.WindowsDesktop.App",
            "version": "6.0.36",
            "architecture": "x86"
          }
        ]
      },
      "registry": {
        "key": "HKCU\\Software\\Cheat Engine",
        "sharedAcrossCopies": true,
        "profileRelevantValues": [
          {
            "kind": "Subkey",
            "name": "Plugins64",
            "reason": "Plugins registered through Settings > Plugins are persisted here; every copy of Cheat Engine, including a sandbox copy, reads the same list."
          },
          {
            "kind": "Subkey",
            "name": "dotnetinfo",
            "reason": "Written by Cheat Engine for its .NET host support; part of the managed-hostfxr route state."
          },
          {
            "kind": "Subkey",
            "name": "VersionCheck",
            "reason": "Controls the update check, the only network access observed at startup."
          },
          {
            "kind": "Value",
            "name": "First Time User",
            "reason": "Changes the first-start behaviour of a fresh copy."
          },
          {
            "kind": "Value",
            "name": "RunAsAdmin",
            "reason": "Elevation request; qualification runs are never elevated."
          },
          {
            "kind": "Value",
            "name": "LuaEngine.showOnPrint",
            "reason": "Opens the Lua Engine window when a script prints, which would disturb an unattended driver."
          },
          {
            "kind": "Value",
            "name": "LuaScriptAction",
            "reason": "How Cheat Engine treats table Lua scripts; the runner loads no table."
          },
          {
            "kind": "Value",
            "name": "AutoAttach",
            "reason": "Automatic process attachment; a qualification run selects its target explicitly."
          },
          {
            "kind": "Value",
            "name": "Always AutoAttach",
            "reason": "Automatic process attachment; a qualification run selects its target explicitly."
          },
          {
            "kind": "Value",
            "name": "Use Windows Debugger",
            "reason": "Debugger interface selection; no scenario starts a debugger."
          },
          {
            "kind": "Value",
            "name": "Use VEH Debugger",
            "reason": "Debugger interface selection; no scenario starts a debugger."
          },
          {
            "kind": "Value",
            "name": "Use Kernel Debugger",
            "reason": "Debugger interface selection; no scenario starts a debugger."
          },
          {
            "kind": "Value",
            "name": "Use DBVM Debugger",
            "reason": "Debugger interface selection; no scenario starts a debugger."
          },
          {
            "kind": "Value",
            "name": "Use dbk32 OpenProcess",
            "reason": "Kernel-driver process access; the qualified backend is a local process opened without a driver."
          },
          {
            "kind": "Value",
            "name": "Use dbk32 ReadWriteProcessMemory",
            "reason": "Kernel-driver memory access; not part of the qualified backend."
          },
          {
            "kind": "Value",
            "name": "Use dbk32 QueryMemoryRegionEx",
            "reason": "Kernel-driver region queries; not part of the qualified backend."
          },
          {
            "kind": "Value",
            "name": "Use Processwatcher",
            "reason": "Process-watcher driver; the process-watcher scenario (Q38) is NotApplicable on this profile."
          }
        ]
      },
      "qualifiedBackends": [
        "LocalProcess"
      ],
      "authorizedTargets": [
        {
          "kind": "QualificationTarget",
          "arch": "x64",
          "sha256": null,
          "source": "tests/CheatEngine.SDK.QualificationTarget, published per run from the tested tree; its SHA-256 is recorded in each receipt."
        },
        {
          "kind": "QualificationTarget",
          "arch": "x86",
          "sha256": null,
          "source": "tests/CheatEngine.SDK.QualificationTarget, published per run for win-x86; its SHA-256 is recorded in each receipt."
        },
        {
          "kind": "GtutorialI386",
          "arch": "x86",
          "sha256": "9131b1ca916d6ac1fb67224a67cf0f578105d43aeeebb03137e94d73cbe11bca",
          "source": "gtutorial-i386.exe from the sandbox copy of the profiled installation; never committed."
        }
      ],
      "sdkPluginContractVersion": 6,